<?xml version="1.0" encoding="UTF-8"?>

<LordOfTheRings xmlns:xsi="http://www.w3.org/2001/XMLSchema-instance" xsi:noNamespaceSchemaLocation="ring.xsd">

    <Personaje>

        <Nombre>Legolas</Nombre>

        <Raza>Elfo</Raza>

        <Edad>2931</Edad>

    </Personaje>

    <Personaje>

        <Nombre>Gimli</Nombre>

        <Raza>Enano</Raza>

        <Edad>139</Edad>

    </Personaje>

</LordOfTheRings>